{
  "specVersion": "syla.execution-receipt/0.1",
  "execution": {
    "id": "run_12425d90-ee47-49c1-b543-bd9b897d92e9",
    "agentId": "market-research-agent",
    "task": "Produce a short competitor brief from a paid data source",
    "startedAt": "2026-08-22T16:21:56.776Z",
    "endedAt": "2026-08-22T16:21:56.782Z"
  },
  "events": [
    {
      "provider": "openrouter",
      "model": "openai/gpt-4.1-mini",
      "inputTokens": 1840,
      "outputTokens": 510,
      "cost": {
        "amount": "0.012",
        "currency": "USD"
      },
      "type": "model.usage",
      "id": "evt_3c84950d-722b-409b-ac97-e412f8bab98f",
      "at": "2026-08-22T16:21:56.781Z"
    },
    {
      "protocol": "x402",
      "scheme": "exact",
      "network": "solana:EtWTRABZaYq6iMfeYKouRu166VU2xqa1",
      "amount": {
        "amount": "0.001",
        "currency": "USDC"
      },
      "cost": {
        "amount": "0.001",
        "currency": "USD"
      },
      "payee": "example-payee",
      "transactionId": "example-signature",
      "resource": "https://api.example.test/paid-data",
      "type": "payment",
      "id": "evt_1831f363-1ed3-4f34-8868-3e035b303926",
      "at": "2026-08-22T16:21:56.782Z"
    },
    {
      "attempt": 2,
      "reason": "first source timed out",
      "cost": {
        "amount": "0.002",
        "currency": "USD"
      },
      "type": "retry",
      "id": "evt_01fc206e-28f8-4b69-b4a9-ff03183d994e",
      "at": "2026-08-22T16:21:56.782Z"
    },
    {
      "evaluator": "brief-rubric-v1",
      "metric": "task_quality",
      "score": 0.92,
      "passed": true,
      "type": "evaluation",
      "id": "evt_c12213f6-155d-4d3b-95b0-5b0ffb017e1b",
      "at": "2026-08-22T16:21:56.782Z"
    }
  ],
  "outcome": {
    "status": "succeeded",
    "qualityScore": 0.92,
    "latencyMs": 6
  },
  "economics": {
    "currency": "USD",
    "modelCost": {
      "amount": "0.012",
      "currency": "USD"
    },
    "toolCost": {
      "amount": "0",
      "currency": "USD"
    },
    "paymentCost": {
      "amount": "0.001",
      "currency": "USD"
    },
    "recoveryCost": {
      "amount": "0.002",
      "currency": "USD"
    },
    "customCost": {
      "amount": "0",
      "currency": "USD"
    },
    "totalCost": {
      "amount": "0.015",
      "currency": "USD"
    }
  },
  "proof": {
    "algorithm": "sha256",
    "canonicalization": "syla-json-v1",
    "digest": "sha256:b36cfe3ad7d4204cd32d3f79de06ef5cca9ee9766cf03eb35446f7d601352d16",
    "createdAt": "2026-08-22T16:21:56.782Z"
  }
}
